{
  "$schema": "ops/schemas/learning-confirmed-legacy-reconstruction.schema.json",
  "artifact_kind": "learning_confirmed_legacy_reconstruction",
  "generated_at": "2026-05-15T13:28:28Z",
  "producer": "ops.scripts.learning_confirmed_legacy_reconstruction",
  "source_command": "python -m ops.scripts.learning_confirmed_legacy_reconstruction --vault .",
  "source_revision": "unknown",
  "source_tree_fingerprint": "08f6d759d04bf1355de3e8f534bb1f9b46152cb7fb92a153f2f7a86bf9143aac",
  "input_fingerprints": {
    "policy": "ebc1bcb948ab54d95dc99bbaed08fbd75b5756dc943c94aa3e2db6321170488f",
    "schema": "45cc51f7ddecbdabfa861b5bcea8d3b4427120a3a0b72c35d75ca4f3cdcad319",
    "artifact_envelope_schema": "87fcb7b91ffc04e8180c1c3e51e309cde186ecf23f91f7974a541d0b580976de",
    "source_paths": "4d2b50ddf187539d8dc58686bc1f5c48c2d825071d40129b1ed231b4262fe7f5",
    "legacy_reconstruction_inputs": "c3d88c47df4338e7e9ab014c71b04711a1c9a5bc3d9d8e02886cbdbdc721deae"
  },
  "schema_version": 1,
  "artifact_status": "current",
  "retention_policy": "canonical_report",
  "encoding": "utf-8",
  "currentness": {
    "status": "current",
    "checked_at": "2026-05-15T13:28:28Z"
  },
  "vault": ".",
  "policy": {
    "path": "ops/policies/wiki-maintainer-policy.yaml",
    "version": 4
  },
  "status": "pass",
  "summary": {
    "reconstruction_sha256": "18b4bd95207dfe6b64690dcd21d27dffb249edbbb312daf8fa4e18d7c81df332",
    "run_count": 5,
    "reconstruction_needed_count": 1,
    "reconstructed_run_count": 1,
    "not_needed_run_count": 4,
    "blocked_run_count": 0,
    "historical_telemetry_mutation": false,
    "operator_reconstruction_diagnostics": [
      {
        "run_id": "run-20260422-auto-improve-decision-record-fallback-retry3-linux-tmp",
        "families": [
          "contract_regression_signals"
        ],
        "reconstruction_status": "not_needed",
        "reconstruction_needed": false,
        "selection_reason": "selected_from_mechanism_review_candidates_for_active_same_eval_family; families=contract_regression_signals",
        "reconstruction_reasons": [],
        "parsed_secondary_axes": [
          "lint",
          "complexity",
          "tests"
        ],
        "parsed_secondary_axis_evidence": {
          "source": "promotion_report_check_detail",
          "check_id": "equal_score_secondary_eligibility",
          "detail": "allowed=true, score_equal=true, selected_axes=['lint', 'complexity', 'tests'], selected_non_regression=false, selected_any_improvement=true",
          "strict_signal": true,
          "axes": [
            "lint",
            "complexity",
            "tests"
          ]
        }
      },
      {
        "run_id": "run-20260422-auto-improve-timeout-telemetry-fallback",
        "families": [
          "contract_regression_signals"
        ],
        "reconstruction_status": "not_needed",
        "reconstruction_needed": false,
        "selection_reason": "selected_from_mechanism_review_candidates_for_active_same_eval_family; families=contract_regression_signals",
        "reconstruction_reasons": [],
        "parsed_secondary_axes": [
          "lint",
          "complexity",
          "tests"
        ],
        "parsed_secondary_axis_evidence": {
          "source": "promotion_report_check_detail",
          "check_id": "equal_score_secondary_eligibility",
          "detail": "allowed=true, score_equal=true, selected_axes=['lint', 'complexity', 'tests'], selected_non_regression=true, selected_any_improvement=true",
          "strict_signal": true,
          "axes": [
            "lint",
            "complexity",
            "tests"
          ]
        }
      },
      {
        "run_id": "run-20260507-auto-improve-existing-telemetry-inline-same-eval-replacement",
        "families": [
          "contract_regression_signals"
        ],
        "reconstruction_status": "not_needed",
        "reconstruction_needed": false,
        "selection_reason": "selected_from_mechanism_review_candidates_for_active_same_eval_family; families=contract_regression_signals",
        "reconstruction_reasons": [],
        "parsed_secondary_axes": [
          "lint",
          "complexity",
          "tests"
        ],
        "parsed_secondary_axis_evidence": {
          "source": "promotion_report_check_detail",
          "check_id": "equal_score_secondary_eligibility",
          "detail": "allowed=true, score_equal=true, selected_axes=['lint', 'complexity', 'tests'], selected_non_regression=true, selected_any_improvement=true",
          "strict_signal": true,
          "axes": [
            "lint",
            "complexity",
            "tests"
          ]
        }
      },
      {
        "run_id": "run-20260507-auto-improve-iteration-persistence-discard-path",
        "families": [
          "contract_regression_signals"
        ],
        "reconstruction_status": "reconstructed",
        "reconstruction_needed": true,
        "selection_reason": "selected_from_mechanism_review_candidates_for_active_same_eval_family; families=contract_regression_signals",
        "reconstruction_reasons": [
          "telemetry behavior_delta_digest missing or invalid",
          "telemetry strict secondary improvement fields missing or incomplete"
        ],
        "parsed_secondary_axes": [
          "lint",
          "complexity",
          "tests"
        ],
        "parsed_secondary_axis_evidence": {
          "source": "promotion_report_check_detail",
          "check_id": "equal_score_secondary_eligibility",
          "detail": "allowed=true, score_equal=true, selected_axes=['lint', 'complexity', 'tests'], selected_non_regression=true, selected_any_improvement=true",
          "strict_signal": true,
          "axes": [
            "lint",
            "complexity",
            "tests"
          ]
        }
      },
      {
        "run_id": "run-20260507-auto-improve-iteration-persistence-typed-same-eval",
        "families": [
          "contract_regression_signals"
        ],
        "reconstruction_status": "not_needed",
        "reconstruction_needed": false,
        "selection_reason": "selected_from_mechanism_review_candidates_for_active_same_eval_family; families=contract_regression_signals",
        "reconstruction_reasons": [],
        "parsed_secondary_axes": [
          "lint",
          "complexity",
          "tests"
        ],
        "parsed_secondary_axis_evidence": {
          "source": "promotion_report_check_detail",
          "check_id": "equal_score_secondary_eligibility",
          "detail": "allowed=true, score_equal=true, selected_axes=['lint', 'complexity', 'tests'], selected_non_regression=true, selected_any_improvement=false",
          "strict_signal": false,
          "axes": [
            "lint",
            "complexity",
            "tests"
          ]
        }
      }
    ],
    "operator_summary": "legacy_reconstruction_runs=5; needed=1; reconstructed=1; blocked=0"
  },
  "reconstruction_identity": {
    "digest_algorithm": "sha256",
    "payload_version": 1,
    "reconstruction_digest": "18b4bd95207dfe6b64690dcd21d27dffb249edbbb312daf8fa4e18d7c81df332"
  },
  "run_reconstructions": [
    {
      "run_id": "run-20260422-auto-improve-decision-record-fallback-retry3-linux-tmp",
      "families": [
        "contract_regression_signals"
      ],
      "telemetry_path": "runs/run-20260422-auto-improve-decision-record-fallback-retry3-linux-tmp/run-telemetry.json",
      "telemetry_sha256": "370f77f245e56c0572e6542a94c5dbf3257f9d533d78da70f01507d83a8007d4",
      "promotion_report_path": "runs/run-20260422-auto-improve-decision-record-fallback-retry3-linux-tmp/promotion-report.json",
      "promotion_report_sha256": "8dbd94b2cf516d0485f975a282cfd77463481a2e4d33d9a4f48cbfb15d15eecd",
      "behavior_delta_path": "runs/run-20260422-auto-improve-decision-record-fallback-retry3-linux-tmp/behavior-delta.json",
      "behavior_delta_artifact_exists": true,
      "behavior_delta_artifact_sha256": "bc4231630e01a551a57771095f5abe69411646b5f79fceeee2999e1163c29d66",
      "telemetry_behavior_delta_digest": "bc4231630e01a551a57771095f5abe69411646b5f79fceeee2999e1163c29d66",
      "telemetry_behavior_delta_digest_valid": true,
      "digest_reconstruction_needed": false,
      "secondary_reconstruction_needed": false,
      "selection_reason": "selected_from_mechanism_review_candidates_for_active_same_eval_family; families=contract_regression_signals",
      "parsed_strict_secondary_improvement_present": true,
      "parsed_secondary_axes": [
        "lint",
        "complexity",
        "tests"
      ],
      "parsed_secondary_axis_evidence": {
        "source": "promotion_report_check_detail",
        "check_id": "equal_score_secondary_eligibility",
        "detail": "allowed=true, score_equal=true, selected_axes=['lint', 'complexity', 'tests'], selected_non_regression=false, selected_any_improvement=true",
        "strict_signal": true,
        "axes": [
          "lint",
          "complexity",
          "tests"
        ]
      },
      "reconstruction_status": "not_needed",
      "reasons": []
    },
    {
      "run_id": "run-20260422-auto-improve-timeout-telemetry-fallback",
      "families": [
        "contract_regression_signals"
      ],
      "telemetry_path": "runs/run-20260422-auto-improve-timeout-telemetry-fallback/run-telemetry.json",
      "telemetry_sha256": "55e4f4f1c4918c55598cc11dec230feb0348a9145ef8ab1c9b447f3a2efd2d8d",
      "promotion_report_path": "runs/run-20260422-auto-improve-timeout-telemetry-fallback/promotion-report.json",
      "promotion_report_sha256": "432276f82246b4c6f2f21991a327ec06b93e847db5c8e0b526df9576d39a026f",
      "behavior_delta_path": "runs/run-20260422-auto-improve-timeout-telemetry-fallback/behavior-delta.json",
      "behavior_delta_artifact_exists": true,
      "behavior_delta_artifact_sha256": "2efb697d67f44f3922f2e3465b1d444fa13031b6d42cc3b6b4af517711ae1991",